{
  "tags": [
    "quantum",
    "photon",
    "Planck constant",
    "frequency"
  ],
  "title": "Planck-Einstein energy-frequency relation",
  "claims_experimental_verification": true,
  "confusion_guard": "E = h f assigns energy to a quantum of frequency f. Photon invariant mass remains zero. The derived mass equivalent m = h f / c² is the inertia of that energy (see frequency-mass-equivalent), not a photon rest mass.",
  "definitions": [
    "E is photon energy",
    "h is the Planck constant",
    "f is ordinary frequency",
    "hbar = h/(2 pi)"
  ],
  "verification_type": "experimental_observation",
  "address": "UPI<QUANTUM_MECHANICS,1,QUANTA,PLANCK_EINSTEIN_RELATION>",
  "assumptions": [
    "For E = h f, the excitation is a photon or a mode quantum",
    "Frequency is defined in the relevant inertial frame"
  ],
  "falsification_conditions": [
    "Precision photon-energy measurements show a reproducible nonlinearity not explained by known physics"
  ],
  "primary_sources": [
    "Planck (1900)",
    "Einstein, Ueber einen die Erzeugung und Verwandlung des Lichtes betreffenden heuristischen Gesichtspunkt (1905)",
    "BIPM SI Brochure: exact h"
  ],
  "information_layer": "ACADEMIC",
  "evidence": [
    {
      "type": "experiment",
      "source": "Photoelectric effect, spectroscopy, Compton scattering, Josephson and quantum electrical standards",
      "confidence": 1.0
    }
  ],
  "equations": [
    "E = h f",
    "E = hbar omega",
    "omega = 2 pi f"
  ],
  "status": "EST",
  "description": "A photon of frequency f has energy E = h f; more generally quantum stationary-state phases evolve with angular frequency E/hbar."
}
