{
  "tags": [
    "qec",
    "stabilizer",
    "syndrome",
    "css",
    "golay"
  ],
  "title": "Quantum error correction as syndrome measurement",
  "version": "0.1.0",
  "claims_experimental_verification": false,
  "confusion_guard": "Syndrome measurement is a quantum operation on a declared code space. Drawing cyan ripples on a lattice plate does not demonstrate a physical self-healing vacuum.",
  "definitions": [
    "A stabilizer group S is an abelian subgroup of the Pauli group not containing -I.",
    "The code space is the +1 eigenspace of every element of S.",
    "A syndrome is the tuple of measurement outcomes of a generating set of checks."
  ],
  "mechanism": "Syndrome measurement projects the state onto a coset of the code. A classical decoder maps the syndrome to a recovery operator. For a CSS code built from G24, that classical decoder can be the Golay decoder shipped in this lab.",
  "predictions": [
    "If all checks yield +1 and the state started in the code space, it remains there.",
    "For a CSS code from G24, any classical weight-≤3 error on one block is in principle correctable."
  ],
  "verification_type": "mathematical_check",
  "address": "UPI<quantum_information,1,error_correction,syndrome_measurement>",
  "assumptions": [
    "Checks commute and can be measured without leaving the code space when no error occurred.",
    "The noise model is declared (e.g. independent Pauli errors below a threshold)."
  ],
  "falsification_conditions": [
    "A declared stabilizer family that does not commute.",
    "A claimed Golay CSS implementation whose measured syndrome does not match the classical parity checks of G24."
  ],
  "primary_sources": [
    "Shor, Scheme for reducing decoherence (1995)",
    "Gottesman, Stabilizer codes (1997)",
    "Calderbank, Shor; Steane: CSS codes"
  ],
  "information_layer": "ACADEMIC",
  "evidence": [
    {
      "type": "calculation",
      "source": "Gottesman, Stabilizer codes and quantum error correction",
      "confidence": 0.99
    },
    {
      "type": "experiment",
      "source": "Multiple laboratory demonstrations of small stabilizer codes (surface, repetition, color) — not a Golay CSS device in this index",
      "confidence": 0.8,
      "notes": "Supports the syndrome mechanism, not a specific G24 quantum implementation here."
    }
  ],
  "equations": [
    "s_i = ±1  from measuring generator g_i",
    "recovery R satisfies R E |ψ>_code ≈ |ψ>_code up to stabilizer for correctable E"
  ],
  "status": "EST",
  "description": "A stabilizer code detects errors by measuring commuting Pauli checks. The syndrome names a coset; a decoder proposes a recovery. Classical codes such as G24 enter as CSS ingredients — they are not themselves quantum memories."
}
