{
  "tags": [
    "stop",
    "planck",
    "horizon",
    "measure"
  ],
  "title": "Sub-Planck horizon of a frequency quantum",
  "version": "0.1.0",
  "claims_experimental_verification": false,
  "confusion_guard": "A formal number S/k printed for a sub-Planck R_s is software, not a black hole and not 'entropy in its purest form' of a lab bit. The purest gravitational entropy remains the in-domain area law.",
  "definitions": [
    "R_s = 2 G m / c².",
    "The semiclassical horizon requires R_s >> ℓ_P.",
    "At 8 Hz, R_s / ℓ_P is of order 10⁻⁴¹."
  ],
  "mechanism": "The algebra still returns a formal S/k. The physical identification with horizon entropy does not, because there is no semiclassical horizon.",
  "predictions": [
    "Every frequency in the audio-to-optical range yields R_s << ℓ_P."
  ],
  "verification_type": "software_test",
  "address": "UPI<information_physics,1,measure,sub_planck_horizon>",
  "assumptions": [
    "m is the inertial mass equivalent of energy h f.",
    "The geometric station of the measure uses a Schwarzschild horizon of that mass."
  ],
  "falsification_conditions": [
    "A controlled system with energy h f whose gravitational radius is measured to be macroscopic without additional concentration of energy."
  ],
  "stop_reason": "R_s(m) << ℓ_P for laboratory frequencies. Smallest next observation: evaluate the geometric station only for a mass whose Schwarzschild radius is many Planck lengths, or replace that station with an in-domain entropy (e.g. Landauer k ln 2 per erased bit) and keep the statuses separate.",
  "primary_sources": [
    "Bekenstein (1973); Hawking (1975) domain of semiclassical gravity"
  ],
  "information_layer": "ACADEMIC",
  "evidence": [
    {
      "type": "calculation",
      "source": "UPI software R_s(f) / ℓ_P for accessible f",
      "confidence": 1.0,
      "notes": "Dimensionally closed. Demonstrates the domain cut; does not invent a trans-Planckian horizon."
    }
  ],
  "equations": [
    "R_s(f) = 2 G h f / c^4",
    "STOP if R_s < ℓ_P"
  ],
  "status": "STOP",
  "description": "For laboratory frequencies the Schwarzschild radius of m = h f / c² is far below ℓ_P. Geometric entropy is then being asked of a horizon that does not exist in the semiclassical theory. The loop STOPS at this station."
}
