{
  "address": "UPI<BASE,0,REFERENCE,N_8HZ>",
  "title": "8 Hz reference coordinate",
  "description": "A configurable numerical normalization example, not a universal physical constant.",
  "status": "DER",
  "quantities": [
    {
      "name": "reference_frequency",
      "value": 8.0,
      "unit": "Hz",
      "reference": "Configurable UPI example"
    }
  ],
  "definitions": ["Z = z / z_ref", "z_ref = 8 Hz in this example"],
  "assumptions": ["The frequency is used only as a declared normalization coordinate"],
  "evidence": [
    {
      "type": "calculation",
      "source": "Declared normalization coordinate in UPI examples; not a measured natural frequency",
      "confidence": 1.0
    }
  ],
  "primary_sources": [
    "UPI example dataset: configurable 8 Hz reference, compared with 7.834 Hz and 8.200 Hz"
  ],
  "reference_frame": "Declared numerical normalization context",
  "normalization_method": "Z = z / z_ref",
  "normalization_claim": "numerical_similarity_only",
  "verification_type": "mathematical_check",
  "claims_experimental_verification": false,
  "confusion_guard": "Does not establish 8 Hz as a universal constant, physical mechanism, medical frequency or rest-mass frequency.",
  "version": "0.1.0"
}
